{
  "schema_version": "ggen.enterprise-architecture-foundry.final-evidence/1",
  "source_head": "d04c69b8cbb65ff9b240bc963d56b9a7bce21f17",
  "corpus_head": "bb69fb099b6cd613b75d6301d75886ab606e14ec",
  "verifier": "ggen-foundry-final-admission-verifier/v1",
  "predicates": {
    "cross_repository_receipts_valid": true,
    "equivalence_failures": 0,
    "fortune_scale_reference_manufactured": true,
    "ggen_kernel_admitted": true,
    "ggen_legacy_corpus_admitted": true,
    "missing_equivalence_cases": 0,
    "replay_differences": 0,
    "solution_admission": true,
    "standing": "ALIVE",
    "unassigned_verifiers": 0,
    "unknown_capabilities": 0,
    "unknown_dispositions": 0,
    "unknown_standings": 0
  },
  "evidence": [
    {
      "repository": "corpus",
      "path": "foundry/workstreams/I/admission-report.json",
      "blake3": "739e1f9f69ad79b846370d0db3c44ce535d77e86dd10af97f8ae2113600026e6"
    },
    {
      "repository": "corpus",
      "path": "foundry/workstreams/K/admission-report.json",
      "blake3": "740ed8e5d7fdbcc69e62d4f900a3e9d388c95d303755eccbecd5983774531242"
    }
  ]
}
